{
  "$schema": "http://json-schema.org/draft-07/schema#",
  "title": "FirewallRule",
  "description": "Schema for a single firewall rule generated by the LLM",
  "type": "object",
  "required": ["rule_id", "action", "protocol", "source", "destination"],
  "additionalProperties": false,

  "properties": {
    "rule_id": {
      "type": "string",
      "description": "Unique identifier for the rule",
      "pattern": "^[a-zA-Z0-9_-]+$",
      "minLength": 1,
      "maxLength": 64
    },

    "action": {
      "type": "string",
      "description": "What to do with matching traffic",
      "enum": ["allow", "deny", "drop", "reject", "log"]
    },

    "protocol": {
      "type": "string",
      "description": "Network protocol",
      "enum": ["tcp", "udp", "icmp", "any", "TCP", "UDP", "ICMP", "ANY"]
    },

    "source": {
      "type": "object",
      "required": ["ip"],
      "additionalProperties": false,
      "properties": {
        "ip": {
          "type": "string",
          "description": "Source IP address or CIDR block or 'any'",
          "pattern": "^(any|\\d{1,3}\\.\\d{1,3}\\.\\d{1,3}\\.\\d{1,3}(\\/\\d{1,2})?)$"
        },
        "port": {
          "oneOf": [
            { "type": "integer", "minimum": 0, "maximum": 65535 },
            { "type": "string", "pattern": "^(any|\\d{1,5}-\\d{1,5})$" }
          ]
        },
        "zone": {
          "type": "string",
          "enum": ["internet", "dmz", "internal", "management", "any"]
        }
      }
    },

    "destination": {
      "type": "object",
      "required": ["ip"],
      "additionalProperties": false,
      "properties": {
        "ip": {
          "type": "string",
          "description": "Destination IP address or CIDR block or 'any'",
          "pattern": "^(any|\\d{1,3}\\.\\d{1,3}\\.\\d{1,3}\\.\\d{1,3}(\\/\\d{1,2})?)$"
        },
        "port": {
          "oneOf": [
            { "type": "integer", "minimum": 0, "maximum": 65535 },
            { "type": "string", "pattern": "^(any|\\d{1,5}-\\d{1,5})$" }
          ]
        },
        "zone": {
          "type": "string",
          "enum": ["internet", "dmz", "internal", "management", "any"]
        }
      }
    },

    "direction": {
      "type": "string",
      "enum": ["inbound", "outbound", "both"]
    },

    "priority": {
      "type": "integer",
      "minimum": 1,
      "maximum": 9999,
      "description": "Rule priority — lower number = higher priority"
    },

    "description": {
      "type": "string",
      "maxLength": 256
    },

    "enabled": {
      "type": "boolean",
      "default": true
    },

    "original_requirement": {
      "type": "string",
      "description": "The original natural language requirement this rule was generated from"
    }
  }
}
